{
  "id": "cand-1",
  "name": "张三",
  "created_at": "2024-01-01",
  "updated_at": "2024-01-01",
  "gender": "男",
  "age": 28,
  "work_years": 5,
  "education": "本科",
  "city": "北京",
  "current_company": "ABC科技有限公司",
  "current_title": "高级软件工程师",
  "status": "在职-看机会",
  "skill_tags": ["Java", "Python", "Spring Boot"],
  "expected_city": ["北京", "上海"],
  "expected_title": "技术负责人",
  "expected_salary": "25-40K",
  "work_experience": [
    {
      "period": "2019-01 - 2023-12",
      "company": "ABC科技有限公司",
      "title": "高级软件工程师",
      "description": "负责后端架构设计和团队管理"
    },
    {
      "period": "2017-06 - 2018-12",
      "company": "XYZ互联网公司",
      "title": "软件工程师",
      "description": "参与电商平台开发"
    }
  ],
  "education_experience": [
    {
      "period": "2013-09 - 2017-06",
      "school": "北京大学",
      "major": "计算机科学与技术",
      "description": "获得学士学位"
    }
  ],
  "enrichment_level": "enriched",
  "sources": [
    {
      "channel": "招聘网站",
      "url": "https://example.com/job/123",
      "found_at": "2024-01-01T10:00:00Z"
    }
  ]
}